Product,Company,Issue,Date received,Consumer complaint narrative
Credit card,CREDIT INC,Billing dispute,2023-01-05,"I was charged twice for the same transaction on my credit card."
Mortgage,HOUSE FIN CORP,Loan modification,2023-02-10,"The lender did not process my request for loan modification."
Bank account,BANK OF MONEY,Unauthorized transaction,2023-03-15,"Someone accessed my account and withdrew money without my permission."
Credit card,CREDIT INC,High interest rates,2023-03-22,"Interest rates were raised without proper notice."
Mortgage,LOANZILLA,Incorrect information on credit report,2023-04-01,"My mortgage account shows wrong information on the credit report."
